{
  "$schema": "https://json-schema.org/draft/2020-12/schema",
  "$id": "https://calisthenics-movement-intelligence.local/contracts/schema/fixture_metadata.v1.schema.json",
  "title": "FixtureMetadata v1",
  "description": "Describes one synthetic decoded-frame sequence used for repeatability and cross-platform conformance. Fixtures bypass platform video decoders so identical pixels reach every backend. Frame ordering, byte lengths, and checksums are verified against the referenced bytes by the Python reference validator. Unknown optional properties are tolerated so the contract can evolve within major version 1.",
  "type": "object",
  "required": [
    "fixture_metadata_schema_version",
    "fixture_id",
    "synthetic",
    "preprocessing_contract_version",
    "frame_width",
    "frame_height",
    "pixel_format",
    "color_space",
    "color_range",
    "channel_order",
    "orientation",
    "frames"
  ],
  "additionalProperties": true,
  "properties": {
    "fixture_metadata_schema_version": {
      "$ref": "#/$defs/semantic_version"
    },
    "fixture_id": {
      "$ref": "#/$defs/uuid"
    },
    "synthetic": {
      "description": "Deliberately generated provenance. Only synthetic fixtures may be committed, so this can never be false in this repository.",
      "const": true
    },
    "preprocessing_contract_version": {
      "description": "Version of the decoded-frame preprocessing contract these bytes were produced under.",
      "$ref": "#/$defs/semantic_version"
    },
    "frame_width": {
      "type": "integer",
      "minimum": 1
    },
    "frame_height": {
      "type": "integer",
      "minimum": 1
    },
    "pixel_format": {
      "description": "Canonical decoded-frame format: packed, row-major, tightly packed 8-bit channels.",
      "const": "rgb24"
    },
    "color_space": {
      "const": "srgb"
    },
    "color_range": {
      "const": "full"
    },
    "channel_order": {
      "const": "rgb"
    },
    "orientation": {
      "description": "Upright with no orientation-dependent transform left to apply.",
      "const": "upright"
    },
    "frames": {
      "description": "Ordered frame descriptors. Missing indexes, duplicates, and timestamp regressions are reported by the reference validator.",
      "type": "array",
      "minItems": 1,
      "items": {
        "$ref": "#/$defs/fixture_frame"
      }
    },
    "generation": {
      "description": "Optional provenance for how the fixture was produced. Contains no participant information.",
      "type": "object",
      "additionalProperties": true,
      "properties": {
        "generator_name": {
          "type": "string",
          "minLength": 1
        },
        "generator_version": {
          "type": "string",
          "minLength": 1
        },
        "generator_git_sha": {
          "type": "string",
          "pattern": "^[0-9a-f]{40}$"
        },
        "generated_at_utc": {
          "$ref": "#/$defs/utc_timestamp"
        },
        "description": {
          "type": "string"
        }
      }
    }
  },
  "$defs": {
    "semantic_version": {
      "type": "string",
      "pattern": "^(0|[1-9][0-9]*)\\.(0|[1-9][0-9]*)\\.(0|[1-9][0-9]*)$"
    },
    "uuid": {
      "type": "string",
      "format": "uuid",
      "pattern": "^[0-9a-f]{8}-[0-9a-f]{4}-[0-9a-f]{4}-[0-9a-f]{4}-[0-9a-f]{12}$"
    },
    "sha256": {
      "type": "string",
      "pattern": "^[0-9a-f]{64}$"
    },
    "utc_timestamp": {
      "type": "string",
      "format": "date-time",
      "pattern": "^[0-9]{4}-[0-9]{2}-[0-9]{2}T[0-9]{2}:[0-9]{2}:[0-9]{2}(\\.[0-9]+)?Z$"
    },
    "fixture_frame": {
      "type": "object",
      "required": [
        "frame_index",
        "timestamp_ns",
        "path",
        "byte_length",
        "sha256"
      ],
      "additionalProperties": true,
      "properties": {
        "frame_index": {
          "type": "integer",
          "minimum": 0
        },
        "timestamp_ns": {
          "description": "Fixture timestamp, mapped one-to-one from the frame index.",
          "type": "integer",
          "minimum": 0
        },
        "path": {
          "description": "Path to the packed RGB24 bytes, relative to the directory holding this metadata file.",
          "type": "string",
          "minLength": 1
        },
        "byte_length": {
          "type": "integer",
          "minimum": 1
        },
        "sha256": {
          "$ref": "#/$defs/sha256"
        }
      }
    }
  }
}
